{
  "schema_version": 1,
  "problem_id": "replace-with-problem-id",
  "statement_version": "v1",
  "title": "Enter the result title",
  "claim_kind": "proof",
  "original_sources": [
    {
      "url": "https://example.org/replace-with-original-source",
      "citation": "Enter the original problem location and version",
      "snapshot_sha256": null
    }
  ],
  "scope": "Enter the complete claim scope; do not substitute the candidate conclusion for the original problem.",
  "required_theorems": [
    "ReplaceWithOfficialTheorem"
  ],
  "toolchain_id": null,
  "trusted_files": [
    {
      "path": "Challenge.lean",
      "sha256": "REPLACE_WITH_SHA256"
    },
    {
      "path": "statement.md",
      "sha256": "REPLACE_WITH_SHA256"
    },
    {
      "path": "correspondence.md",
      "sha256": "REPLACE_WITH_SHA256"
    },
    {
      "path": "definitions.md",
      "sha256": "REPLACE_WITH_SHA256"
    }
  ],
  "review": {
    "status": "pending",
    "statement_digest": null,
    "reviewers": [],
    "evidence_url": null
  }
}
